{
  "$schema": "https://json-schema.org/draft/2020-12/schema",
  "$id": "https://event-hunter.local/schemas/grafana-alert-webhook.schema.json",
  "title": "GrafanaAlertWebhook",
  "type": "object",
  "additionalProperties": true,
  "required": [
    "receiver",
    "status",
    "orgId",
    "alerts",
    "groupLabels",
    "commonLabels",
    "commonAnnotations",
    "externalURL",
    "version",
    "groupKey",
    "truncatedAlerts",
    "state"
  ],
  "properties": {
    "receiver": { "type": "string", "minLength": 1 },
    "status": { "type": "string", "enum": ["firing", "resolved"] },
    "orgId": { "type": "integer", "minimum": 1 },
    "alerts": {
      "type": "array",
      "minItems": 1,
      "items": { "$ref": "#/$defs/alert" }
    },
    "groupLabels": { "$ref": "#/$defs/stringMap" },
    "commonLabels": { "$ref": "#/$defs/stringMap" },
    "commonAnnotations": { "$ref": "#/$defs/stringMap" },
    "externalURL": { "type": "string" },
    "version": { "type": "string", "const": "1" },
    "groupKey": { "type": "string", "minLength": 1 },
    "truncatedAlerts": { "type": "integer", "minimum": 0 },
    "title": { "type": "string" },
    "state": { "type": "string", "enum": ["alerting", "ok"] },
    "message": { "type": "string" }
  },
  "$defs": {
    "stringMap": {
      "type": "object",
      "additionalProperties": { "type": "string" }
    },
    "alert": {
      "type": "object",
      "additionalProperties": true,
      "required": [
        "status",
        "labels",
        "annotations",
        "startsAt",
        "endsAt",
        "generatorURL",
        "fingerprint"
      ],
      "properties": {
        "status": { "type": "string", "enum": ["firing", "resolved"] },
        "labels": { "$ref": "#/$defs/stringMap" },
        "annotations": { "$ref": "#/$defs/stringMap" },
        "startsAt": { "type": "string", "format": "date-time" },
        "endsAt": { "type": "string", "format": "date-time" },
        "generatorURL": { "type": "string" },
        "fingerprint": { "type": "string", "minLength": 1 },
        "silenceURL": { "type": "string" },
        "dashboardURL": { "type": "string" },
        "panelURL": { "type": "string" },
        "imageURL": { "type": "string" },
        "values": { "type": "object", "additionalProperties": true }
      }
    }
  }
}
